{
  "format_version": 1,
  "release_id": "rc-20261024.51.1",
  "created_at": "2026-10-23T18:38:16.439623+00:00",
  "platform": "windows-amd64-cp313",
  "application_version": "0.1.0",
  "source_revision": null,
  "source_tree_sha256": "191dee35db54448ff30916d754be0f42ca446733ac3612d03d716b8890fd8acf",
  "python": {
    "implementation": "CPython",
    "major": 3,
    "minor": 13,
    "build_version": "3.13.1"
  },
  "contracts": {
    "version": "0.4.0",
    "sha256": "7dc6c77c3ae0800f996c81f7e5cb2cb7e5d82caa43fe81f80c628a1bdd255d51"
  },
  "database": {
    "head": "d682a0b14139",
    "migrations_sha256": "8f70a086ae551b34c52246343abfbf22808bf3834d381b7cbe48bf8db33ca898",
    "auto_migrate": false
  },
  "worker": {
    "protocols": [
      "0.4.0"
    ],
    "journal_source_sha256": "659e3ac21ea6bde103a8803668a12f33b0c27d5dd97dac26d7bacd3847283a15"
  },
  "workflows": {
    "required_task_types": [
      "text_to_image",
      "text_to_video",
      "image_to_image",
      "references_to_image",
      "references_to_video"
    ],
    "validated_releases": []
  },
  "gateway": {
    "upstream_repository": "https://github.com/Wei-Shaw/sub2api",
    "upstream_commit": "7da09cab4e875463baa79fc150adde700c5438df",
    "provider_binary_sha256": "fc5b5669325e3444de0cafa60e10beb0df707161064fa9a4f728799f7d7db2e0",
    "frontend_embedded": false
  },
  "runtime": {
    "requires_python": ">=3.13,<3.14",
    "lock_sha256": "20105a02703ca67db5cad4cc0f6a1055271a3715bc595948284a1305692b4546",
    "requirements_sha256": "ebb904a5dff8ae67109279d2dc023c2d884bbb0cfed77660f6582c0687ff945c"
  },
  "files": [
    {
      "path": "admin/assets/_plugin-vue_export-helper-DlAUqK2U.js",
      "bytes": 91,
      "sha256": "cb85b0f263dbe24e857338301c0627076592e9f1f1a5662929f86d2c126444aa"
    },
    {
      "path": "admin/assets/Alerts-CP99xNhy.js",
      "bytes": 5979,
      "sha256": "13724d18f51933d02cabd216606356941f93e735ae91bd1f28f6df2fb7b1d8e9"
    },
    {
      "path": "admin/assets/Channels-C0Zcvre7.css",
      "bytes": 386,
      "sha256": "80d4ab8d571140b7899b750d6e96b7a536ce644ec207fd34656d5f83168db967"
    },
    {
      "path": "admin/assets/Channels-Kk3Ri6Q5.js",
      "bytes": 25277,
      "sha256": "d4c302f9a59cc1ac2a852137565165fc4a8c922382287c76fa9c091004765258"
    },
    {
      "path": "admin/assets/Content--DP-LAib.js",
      "bytes": 17479,
      "sha256": "b0d24535ee0a593c37fcb0f23ebd8e8073ff4969fa80da920ee4ca4bcdeb1641"
    },
    {
      "path": "admin/assets/Content-aYf7qVaH.css",
      "bytes": 1860,
      "sha256": "0cd0bdc3abc17dcccf98ca410ecb5bf53c62a7a394cfc1dede75540c9472a165"
    },
    {
      "path": "admin/assets/Gateways-BTxfOi_y.js",
      "bytes": 11103,
      "sha256": "16d24e83e57e441f4c5d975f7bd08514a7d97f0357594f0fea7dd6ebfae3559a"
    },
    {
      "path": "admin/assets/index-DTy1W7uY.js",
      "bytes": 1057851,
      "sha256": "1deb0cb4a7a07826a60d77186403662857b1ede1e2eeb2d37adce2b26376b511"
    },
    {
      "path": "admin/assets/index-GLRZaBAL.css",
      "bytes": 369016,
      "sha256": "a33590ec9c5ba93cdd633edd3d994572a1cb16277e37954f92b9ed9a9385e011"
    },
    {
      "path": "admin/assets/Jobs-YP4Glq3t.js",
      "bytes": 13140,
      "sha256": "645de673e1a3b14fa2278d15ee7997823dbf8dbec34173400daee5e460e93000"
    },
    {
      "path": "admin/assets/KeyAccess-DaDYgnlc.css",
      "bytes": 480,
      "sha256": "480f44ef10a612c07a9e66fe86170ab8a01efd56d4e910f299b18408d285d6e3"
    },
    {
      "path": "admin/assets/KeyAccess-ohiozy1Y.js",
      "bytes": 6624,
      "sha256": "e3deea385b081725889b200954a8cd2f184defa1075661650281c246d9f2638a"
    },
    {
      "path": "admin/assets/Keys-BGkw3CgO.js",
      "bytes": 17022,
      "sha256": "d7f4c00e4b2ed62c22cfccfe090f8caf5f2cddea9a023233becb648d11bb78bb"
    },
    {
      "path": "admin/assets/ModelArtifacts-De6SLCot.js",
      "bytes": 9269,
      "sha256": "c0e442c320fa67f90c36cd7d90bc6f3a27b553e1db912e6985648f03d0c1f01a"
    },
    {
      "path": "admin/assets/Models-BjTz3kV8.js",
      "bytes": 12551,
      "sha256": "5ed23a8173fbbc310e3a8b35a3f9f0dbc265bd4631eee1e18a7a8e7ec0af4b08"
    },
    {
      "path": "admin/assets/Overview-CCG2iO3N.js",
      "bytes": 5937,
      "sha256": "c9f70d157252dffbf1e8ff0b97482ee1ea2a9092d0373dd1155041aaf56149f8"
    },
    {
      "path": "admin/assets/Overview-DZcqj79i.css",
      "bytes": 357,
      "sha256": "0bf02b42ff9a9f8363759380d781319f66b102d0f7c1d5c406ddbacf245a696b"
    },
    {
      "path": "admin/assets/QueueFilters-BKByoGbf.js",
      "bytes": 7235,
      "sha256": "414ca2ab9e20112837dd211fd42dc6e068e83ee7d43d6decc107c48b2f9bba96"
    },
    {
      "path": "admin/assets/QueueFilters-CJQcCY3X.css",
      "bytes": 810,
      "sha256": "5062baf9e88d7a8e86949e50ab9c359f56f43942336760d5a0d5a5a0f0625ae5"
    },
    {
      "path": "admin/assets/Records-DYZfglPS.js",
      "bytes": 6124,
      "sha256": "db111a56c8ff664caf1d4bed6895b934adfeb4bcc5a3a43d17a01994ddcd18f7"
    },
    {
      "path": "admin/assets/SpecIsolations-C0HvYHhp.js",
      "bytes": 8572,
      "sha256": "ff967be27f7f8df76eb96dbd1f1462cf1311e298defa3a1ddcce816aedafba0c"
    },
    {
      "path": "admin/assets/Users-BUCR2MLC.js",
      "bytes": 7016,
      "sha256": "9de308580c7c3eee3ea95520dc59fc5f3e89e8335c6fe0cb90c447f31bbbab0a"
    },
    {
      "path": "admin/assets/Workflows-BmFNUTAy.js",
      "bytes": 31830,
      "sha256": "8d7a1d0be9802618984418b805e9c7a8f5e4efa5acd782e691994aa875077360"
    },
    {
      "path": "admin/assets/Workflows-CsD7kii1.css",
      "bytes": 1081,
      "sha256": "5909511dacd7fe16696a684efaef70a38019d7da765e2931b5ea6652c7cdf8e9"
    },
    {
      "path": "admin/index.html",
      "bytes": 436,
      "sha256": "a31b18e34d248c978c15050ad1c5c10cb51cd33222703c9bffb8a4db426eda76"
    },
    {
      "path": "alembic.ini",
      "bytes": 89,
      "sha256": "e7955a0ffb9c32a9c5067d7885ee9197328f17a4a12fb4a5bb556c2b85763aa2"
    },
    {
      "path": "config/contract-hashes.json",
      "bytes": 1949,
      "sha256": "e6fef8e4dd9cd00c8bcc40a6d43f81b10bb6d9076e03a22649fe7155f65de731"
    },
    {
      "path": "config/environment.example",
      "bytes": 600,
      "sha256": "0a0dcdccc3c8cb72369a4067b9f42545837febc156f6c435f5a9f717225485c6"
    },
    {
      "path": "config/release-manifest.schema.json",
      "bytes": 5966,
      "sha256": "945b24b91e681bfe1caf2926d9ebf346353dc460003dd9a128d280cc59cf0e2f"
    },
    {
      "path": "config/worker.example.json",
      "bytes": 502,
      "sha256": "7a334a563667032825f0f61f71e7b3d615650bb7af458e25a39fa2def8ec529e"
    },
    {
      "path": "config/worker.workflow-pull.example.json",
      "bytes": 689,
      "sha256": "459adb9849be5dcb213ed178eafc6314061d2d8d45a5508382a43b77645493a6"
    },
    {
      "path": "gateway/LICENSE",
      "bytes": 7651,
      "sha256": "a5681bf9b05db14d86776930017c647ad9e6e56ff6bbcfdf21e5848288dfaf1b"
    },
    {
      "path": "gateway/sub2api-provider.exe",
      "bytes": 162636288,
      "sha256": "fc5b5669325e3444de0cafa60e10beb0df707161064fa9a4f728799f7d7db2e0"
    },
    {
      "path": "integrations/sub2api/upstream-lock.json",
      "bytes": 3308,
      "sha256": "a5e2917ec34c9d671ee442345d073e9638d864597a237441240b26b61396b661"
    },
    {
      "path": "migrations/env.py",
      "bytes": 978,
      "sha256": "3a9e00d27e677d8d52504d5829164be11ed6d34f227de2cfc5cfbce6d994ff68"
    },
    {
      "path": "migrations/script.py.mako",
      "bytes": 374,
      "sha256": "055c487c930356359a16af831e2dc2c746aa06806a051136161713fd5fa9bac5"
    },
    {
      "path": "migrations/versions/0447f1bc065f_runtime_approval_and_frozen_commands.py",
      "bytes": 1908,
      "sha256": "10874690c642ea5d4ebddc882140d9fd359c2e296e18be6160389ef58f2056a3"
    },
    {
      "path": "migrations/versions/057c750203d8_freeze_channel_per_attempt.py",
      "bytes": 774,
      "sha256": "a834a78a03d53a88c11f32759c2a336d56e39317b35ccb702afabbeb58529a91"
    },
    {
      "path": "migrations/versions/08adf2d194a6_content_retention_and_gc_claims.py",
      "bytes": 4451,
      "sha256": "0e8d0f39716d98665036892324825f553ffa9600515a10eff1512a43ab626a98"
    },
    {
      "path": "migrations/versions/117d88b880a0_initial_control_plane.py",
      "bytes": 41936,
      "sha256": "deaa5b4773dd5df8cbcb58d49332cf25a6a46176e7a00af2f8ca7716d3a545cc"
    },
    {
      "path": "migrations/versions/3e15b92f08dc_gateway_fence_guards.py",
      "bytes": 5914,
      "sha256": "d6c23a49d180bdc52c4513af017a0d71ae192d2307c98cf063da295693969c84"
    },
    {
      "path": "migrations/versions/42c18ae2a3c6_verified_output_uploads.py",
      "bytes": 1616,
      "sha256": "06c151c5910ebf24dce967438473ca7876ace464ce4e34948c440f40ac9bde84"
    },
    {
      "path": "migrations/versions/4e5630a241a0_model_artifact_catalog.py",
      "bytes": 988,
      "sha256": "1d14ac8c4e71222eee398d8a4123d6a30f3760c8f5cea15079c718974cba1032"
    },
    {
      "path": "migrations/versions/6215c99c40e1_channel_resource_revision.py",
      "bytes": 641,
      "sha256": "5f8ba72a5a685286a881f81c84f72b547596e09bc3ebeb62a2ce4516f778c976"
    },
    {
      "path": "migrations/versions/6b61d820e7ab_admin_job_retry_integrity.py",
      "bytes": 1765,
      "sha256": "f5baa89424f82246a8f135b866d01dfccf088b62df1d133b1a12755bf3463584"
    },
    {
      "path": "migrations/versions/6b7d9e51c420_gateway_request_fences.py",
      "bytes": 2500,
      "sha256": "7ad445d9a5072b3dc033fb17da785ac7eb3380635e514c26941d258676ede4cb"
    },
    {
      "path": "migrations/versions/9006104170aa_gpu_management_drain_guard.py",
      "bytes": 577,